{
  "idea_id": "maintenance-agent",
  "research_sha": "sha256:maintenance-placeholder",
  "verdict": "approve",
  "rationale": "Strong ROI if automation prevents regressions and catches drift before orchestrator runs.",
  "approved_features": {
    "core": ["Plan drift detector", "Registry reconciliation"],
    "gap": ["Human override console"],
    "future": ["Cost anomaly alerts"]
  },
  "risks": ["Requires reliable telemetry inputs", "Needs guardrails to avoid thrashing agents"],
  "notes": ["Prioritize auditability for every automated action"],
  "reviewed_at": "2025-10-10T13:30:00Z"
}
